objectid,sort_index,parentid,admin_notes,title,creator,date,description,subject,people,location,latitude,longitude,source,identifier,type,format,language,rights,rightsstatement,display_template,WORKSPACE1,WORKSPACE2,WORKSPACE3,object_location,image_small,image_thumb,image_alt_text,object_transcript,temp1,temp2,temp3
grinnell_23628,44,,,"Commencement, 1972",,1972-05,Students and family at the 1972 Commencement. Robed graduates left to right: LuVernne Vann; Linda Copeland Rozell; Alan D. Wheat; Carl Brennan. Many of the students were members of CBS.,Life at Grinnell for Black Students,Linda Copeland '72;  LuVernne Vann '72; Alan (Al) D. Wheat '72; Carl Brennnan '72,Grinnell College,41.74789405416524,-92.72105048334146,Grinnell College,grinnell:23628,Image;StillImage,image/tiff,eng,"Copyright to this work is held by the author(s), in accordance with United States copyright law (USC 17). Readers of this work have certain rights as defined by the law, including but not limited to fair use (17 USC 107 et seq.).",,,,,,https://dgobjects.blob.core.windows.net/objs/grinnell-23628.tiff,https://dgobjects.blob.core.windows.net/smalls/grinnell-23628_SMALL.jpg,https://dgobjects.blob.core.windows.net/thumbs/grinnell-23628_TN.jpg,,,,,
grinnell_34002,61,,,"Commencement, 1975",,1975-05,"Milton ""Butch"" Rolland, class of 1975, left, and Barbara Critton, class of 1975, right, during commencement.Both were members of CBS and attended Grinnell College during the ‘71 Burling Takeover",Life at Grinnell for Black Students,Milton P. Rolland '75;  Barbara L. Critton '75,Grinnell College,41.74789405416524,-92.72105048334146,Grinnell College,grinnell:34002,Image;StillImage,image/tiff,eng,"Copyright to this work is held by the author(s), in accordance with United States copyright law (USC 17). Readers of this work have certain rights as defined by the law, including but not limited to fair use (17 USC 107 et seq.).",,,,,,https://dgobjects.blob.core.windows.net/objs/grinnell-34002.tiff,https://dgobjects.blob.core.windows.net/smalls/grinnell-34002_SMALL.jpg,https://dgobjects.blob.core.windows.net/thumbs/grinnell-34002_TN.jpg,,,,,
grinnell_5768,26,,,David Weston and Mary Gae Wyly in the Library,"Mcmullin, Roger W.",1972-04,"David Weston, class of 1973, and Mary Gae Wyly, reference librarian, looking through the library catalog. Wyly was reportedly one of the librarians who worked on reorganizing and expanding the Black Library.",Burling Library;Black Manifesto Demands;Black Library,"Mae Gae Wyly, Librarian; David Weston '73",Burling Library,41.746718787662246,-92.72028416032282,Grinnell College,grinnell:5768,Image;StillImage,image/tiff,eng,"Copyright to this work is held by the author(s), in accordance with United States copyright law (USC 17). Readers of this work have certain rights as defined by the law, including but not limited to fair use (17 USC 107 et seq.).",,,,,,https://dgobjects.blob.core.windows.net/objs/grinnell-5768.tiff,https://dgobjects.blob.core.windows.net/smalls/grinnell-5768_SMALL.jpg,https://dgobjects.blob.core.windows.net/thumbs/grinnell-5768_TN.jpg,,,,,
grinnell_3601,1,,,Denise L. Iverson ’74 and Roxane D. Brown ’74 in the Black Cultural Center,"Henry, George T.",1971,"Denise L. Iverson ’74 (at table) and Roxane D. Brown ’74 (at bookshelf) in the Black Cultural Center (BCC). The creation of the BCC was one of the first goals of CBS, and it was realized in 1969. While it initially served as gathering space, it also became student housing when there was a shortage of dorm rooms. In 1971, First-years Iverson and Brown lived in the BCC with Lurverne Vann (Bell) ‘72, Juanita Carswell ‘71, and Sylvia Wallace ‘73. During the 1971 Burling Take Over, the 7th demand of the Black Manifesto stated that “because of the enrollment and the programs of CBS,we feel that the present Cultural Center is insufficient, therefore we demand a house large enough to accommodate the programs of CBS”.",Life at Grinnell for Black Students;Concerned Black Students (CBS);Black Manifesto Demands,Denise L. Iverson ’74; Roxane D. Brown ’74,The Conney M. Kimbo Black Cultural Center,41.75300289,-92.72210871,Grinnell College,grinnell:3601,Image;StillImage,image/tiff,eng,"Copyright to this work is held by the author(s), in accordance with United States copyright law (USC 17). Readers of this work have certain rights as defined by the law, including but not limited to fair use (17 USC 107 et seq.).",,,,,,https://dgobjects.blob.core.windows.net/objs/grinnell-3601.tiff,https://dgobjects.blob.core.windows.net/smalls/grinnell-3601_SMALL.jpg,https://dgobjects.blob.core.windows.net/thumbs/grinnell-3601_TN.jpg,,,https://digital.grinnell.edu/islandora/object/grinnell:3601/datastream/OBJ,,https://digital.grinnell.edu/islandora/object/grinnell:3601/datastream/TN/view
grinnell_26787,94,,,ERA,"Farbes, Hubert '69",1968-02-02,"Students examining nature. Left to right: Hubert Farbes '69, Unknown. Farbes became the first President of CBS on February 2nd, 1968.",Life at Grinnell for Black Students,Hubert Farbes '69,Grinnell College,41.74789405416524,-92.72105048334146,Grinnell College,grinnell:26787,Image;StillImage,image/tiff,eng,"Copyright to this work is held by the author(s), in accordance with United States copyright law (USC 17). Readers of this work have certain rights as defined by the law, including but not limited to fair use (17 USC 107 et seq.).",,,,,,https://dgobjects.blob.core.windows.net/objs/grinnell-26787.tiff,https://dgobjects.blob.core.windows.net/smalls/grinnell-26787_SMALL.jpg,https://dgobjects.blob.core.windows.net/thumbs/grinnell-26787_TN.jpg,,,,,
dg_1712600289,88,dg_1712600285,Libby's additions - Parent/child - Libby needs to rescan!! ,FBI Memo: 157-542-E,FBI,,"FBI memo giving a brief overview of Grinnell College, including the fact that the college had about 50 Black students at the time. The memo states that the FBI will continue to monitor the activities of the Concerned Black Students organization",Concerned Black Students (CBS),,Grinnell College,41.74979353915572, -92.72096299948862,,,text;scanned,application/pdf,eng,"Copyright to this work is held by the author(s), in accordance with United States copyright law (USC 17). Readers of this work have certain rights as defined by the law, including but not limited to fair use (17 USC 107 et seq.).",,,,,,https://dgobjects.blob.core.windows.net/objs/dg_1712600289.pdf,.jpeg,.jpeg,,,,,
dg_1712600287,10,dg_1712600285,Libby's additions - Parent/child,FBI Memo: Black Student Demostration at Grinnell College,FBI,1971-11-30,FBI memo about the Burling Library Takeover. Much of the information is redacted.,Burling Library Take Over of '71 & '72;Reactions to the Take Over;Concerned Black Students (CBS);Burling Library,,Grinnell College,41.74979353915572, -92.72096299948862,,,text;scanned,application/pdf,eng,"Copyright to this work is held by the author(s), in accordance with United States copyright law (USC 17). Readers of this work have certain rights as defined by the law, including but not limited to fair use (17 USC 107 et seq.).",,,,,,https://dgobjects.blob.core.windows.net/objs/dg_1712600287.pdf,https://dgobjects.blob.core.windows.net/smalls/dg_1712600287_SMALL.jpg,https://dgobjects.blob.core.windows.net/thumbs/dg_1712600287_TN.jpg,,,,,
dg_1712600288,13,dg_1712600285,Libby's additions - Parent/child - Libby needs to rescan!! ,FBI Memo: Concerned Black Students ,FBI,1971-12-03,"FBI cover sheet for an enclosed eleven LHM summaries of CBS students. FBI Letter Head Memoranda (LHM) are documents containing potentially
derogatory information about the subject of the LHM.",Burling Library Take Over of '71 & '72;Reactions to the Take Over;Concerned Black Students (CBS),,Grinnell College,41.74979353915572, -92.72096299948862,,,text;scanned,application/pdf,eng,"Copyright to this work is held by the author(s), in accordance with United States copyright law (USC 17). Readers of this work have certain rights as defined by the law, including but not limited to fair use (17 USC 107 et seq.).",,,,,,https://dgobjects.blob.core.windows.net/objs/dg_1712600288.pdf,.jpeg,.jpeg,,,,,
dg_1712600290,14,dg_1712600285,Libby's additions - Parent/child ,FBI Memo: Concerned Black Students; Extremist Matters,FBI,1971-12-03,"FBI memo from the Director's office to the Omaha field office. The letter refers to the Burling Takeover by CBS and directs the office to re-open its investigations into the group and discover its leadership, aims, and objectives and activities.",Concerned Black Students (CBS),,Grinnell College,41.74979353915572, -92.72096299948862,,,text;scanned,application/pdf,eng,"Copyright to this work is held by the author(s), in accordance with United States copyright law (USC 17). Readers of this work have certain rights as defined by the law, including but not limited to fair use (17 USC 107 et seq.).",,,,,,https://dgobjects.blob.core.windows.net/objs/dg_1712600290.pdf,https://dgobjects.blob.core.windows.net/smalls/dg_1712600290_SMALL.jpg,https://dgobjects.blob.core.windows.net/thumbs/dg_1712600290_TN.jpg,,,,,
dg_1712600286,87,,Libby's additions - Parent/child,FBI memos reflecting invesigations into Grinnell Students,,,"The FBI investigated students groups around the country as the conservative government saw them as potential threats to national security. The files related to their investigations were released to a Freedom of Information Act (FOIA) request. The surveillance of CBS started after the Des Moines Black Panther Party headquarters were bombed on April 26th, 1969.",Burling Library Take Over of '71 & '72;Reactions to the Take Over;Concerned Black Students (CBS),,Grinnell College,41.74979353915572, -92.72096299948862,,,text;scanned,application/pdf,eng,"Copyright to this work is held by the author(s), in accordance with United States copyright law (USC 17). Readers of this work have certain rights as defined by the law, including but not limited to fair use (17 USC 107 et seq.).",,,,,,https://dgobjects.blob.core.windows.net/objs/dg_1712600286.pdf,.jpeg,.jpeg,,,,,
grinnell_12935,98,,,Gregory Coggs and Frank Thomas at the Black Cultural Center,,1969,"Left to right: Gregory M. Coggs, class of 1970, and Frank E. Thomas, class of 1971, sitting on the front step of the Black Cultural Center (BBC), May 1970.",Concerned Black Students (CBS);Life at Grinnell for Black Students;Black Manifesto Demands,Gregg Coggs '69; Frank Thomas '71,The Conney M. Kimbo Black Cultural Center,41.74665973,-92.72017393,Grinnell College,grinnell:12935,Image;StillImage,image/tiff,eng,"Copyright to this work is held by the author(s), in accordance with United States copyright law (USC 17). Readers of this work have certain rights as defined by the law, including but not limited to fair use (17 USC 107 et seq.).",,,,,,https://dgobjects.blob.core.windows.net/objs/grinnell-12935.tiff,https://dgobjects.blob.core.windows.net/smalls/grinnell-12935_SMALL.jpg,https://dgobjects.blob.core.windows.net/thumbs/grinnell-12935_TN.jpg,,,,,
dg_1711478420,60,,DELETE 'Was grinnell:4995 as compound of TIFF images. Converted to PDF.,Grinnell Black Alumni Newsletter 1975,,1975-04,Grinnell Black Alumni Newsletter Vol.2 No.2. Created with the CBS group,;;,,Grinnell College,,,Grinnell College,grinnell:4995,newspaper;print,application/pdf,eng,"Copyright to this work is held by the author(s), in accordance with United States copyright law (USC 17). Readers of this work have certain rights as defined by the law, including but not limited to fair use (17 USC 107 et seq.).",,,,,,https://dgobjects.blob.core.windows.net/objs/dg_1711478420_OBJ.pdf,https://dgobjects.blob.core.windows.net/smalls/dg_1711478420_JPG.jpg,https://dgobjects.blob.core.windows.net/thumbs/dg_1711478420_TN.jpg,,,,,
grinnell_23551,90,,,Howie Ward with Pal,,1966,Howie Ward with rat. Howie was a member of CBS.,Life at Grinnell for Black Students,Howard Ward ‘69,Grinnell College,41.7485168518476,-92.71979713273882,Grinnell College,grinnell:23551,Image;StillImage,image/tiff,eng,"Copyright to this work is held by the author(s), in accordance with United States copyright law (USC 17). Readers of this work have certain rights as defined by the law, including but not limited to fair use (17 USC 107 et seq.).",,,,,,https://dgobjects.blob.core.windows.net/objs/grinnell-23551.tiff,https://dgobjects.blob.core.windows.net/smalls/grinnell-23551_SMALL.jpg,https://dgobjects.blob.core.windows.net/thumbs/grinnell-23551_TN.jpg,,,,,
grinnell_1890,76,,,Information Concerning Grinnell College's Buildings And Facilities Including Facts Related To Its History,"Walker, Waldo S.",1997-09-03,"A timeline of facts related to Grinnell College history, including enrollment, tuition, and building information. Includes information on guest speakers on campus, student activism, and the Burling Library Take Over",Burling Library;Burling Library Take Over of '71 & '72,,Grinnell College,41.74665973,-92.72017393,Grinnell College,grinnell:1890,text; miscellaneous document,application/pdf,eng,"Copyright to this work is held by the author(s), in accordance with United States copyright law (USC 17). Readers of this work have certain rights as defined by the law, including but not limited to fair use (17 USC 107 et seq.).",,,,,,https://dgobjects.blob.core.windows.net/objs/grinnell-1890.pdf,https://dgobjects.blob.core.windows.net/smalls/grinnell-1890_SMALL.jpg,https://dgobjects.blob.core.windows.net/thumbs/grinnell-1890_TN.jpg,,,,,
grinnell_5003,16,,,Irma McClaurin,"Sableman, Mark S.",1972,Photo of Irma McClaurin '72. McClaurin was an active member of CBS and participated in the Burling Library Takeover.,Life at Grinnell for Black Students,Irma McClaurin '72,Grinnell College,41.75087415386575,-92.72182128988476,Grinnell College,grinnell:5003,Image;StillImage,image/tiff,eng,"Copyright to this work is held by the author(s), in accordance with United States copyright law (USC 17). Readers of this work have certain rights as defined by the law, including but not limited to fair use (17 USC 107 et seq.).",,,,,,https://dgobjects.blob.core.windows.net/objs/grinnell-5003.tiff,https://dgobjects.blob.core.windows.net/smalls/grinnell-5003_SMALL.jpg,https://dgobjects.blob.core.windows.net/thumbs/grinnell-5003_TN.jpg,,,,,
grinnell_23385,82,,,"Jon Royal '70, Diane Alters '71, Mary Brooner '71 & Sheena Thomas '71","Elias, Benyamin '15;McFate, Mackenzie '18; 	Maly, Nancy '61 ",2015-05-29,"Alumni oral history interview with Jon Royal '70, Diane Alters '71, Mary Brooner '71 & Sheena Thomas '71. Recorded May 29, 2015. These students were a part of an exchange program with the Historically Black College (HBCU) LeMoyne-Owen College.",Life at Grinnell for Black Students,,Grinnell College,41.75087875356788,-92.71930563181974,Grinnell College,grinnell:23385,interview;sound recording-nonmusical,audio/mp3,eng,"Copyright to this work is held by the author(s), in accordance with United States copyright law (USC 17). Readers of this work have certain rights as defined by the law, including but not limited to fair use (17 USC 107 et seq.).",,,,,,https://dgobjects.blob.core.windows.net/objs/grinnell-23385.vtt,,https://dgobjects.blob.core.windows.net/thumbs/grinnell_23385_TN.jpg,,https://dgobjects.blob.core.windows.net/transcripts/grinnell_23385_MEDIATRACK.vtt,,,
dg_1712600281,29,,Libby's additions- Should this be a compound? ,Leggett's Draft Guidelines for the Black Library 4/12,Office of President Leggett,1972-04-12,Document outlining Leggetts plan for the Black Library,Burling Library;Black Library;Reactions to the Take Over;Black Manifesto Demands,"Glenn Leggett, Grinnell President  1965-1975",Burling Library,41.746718787662246,-92.72028416032282,Grinnell College,,text;scanned,application/pdf,eng,"Copyright to this work is held by the author(s), in accordance with United States copyright law (USC 17). Readers of this work have certain rights as defined by the law, including but not limited to fair use (17 USC 107 et seq.).",,,,,,https://dgobjects.blob.core.windows.net/objs/dg_1712600281.pdf,https://dgobjects.blob.core.windows.net/smalls/dg_1712600281_SMALL.jpg,https://dgobjects.blob.core.windows.net/thumbs/dg_1712600281_TN.jpg,,,,,
dg_1712600282,28,,Libby's additions- Should this be a compound? ,Leggett's Draft Guidelines for the Black Library 4/8,Office of President Leggett,1972-04-08,An early draft outlining Leggett's plan for the Black Library,Burling Library Take Over of '71 & '72;Burling Library;Black Library;Black Manifesto Demands,"Glenn Leggett, Grinnell President  1965-1975",Burling Library,41.746718787662246,-92.72028416032282,Grinnell College,,text;scanned,application/pdf,eng,"Copyright to this work is held by the author(s), in accordance with United States copyright law (USC 17). Readers of this work have certain rights as defined by the law, including but not limited to fair use (17 USC 107 et seq.).",,,,,,https://dgobjects.blob.core.windows.net/objs/dg_1712600282.pdf,https://dgobjects.blob.core.windows.net/smalls/dg_1712600282_SMALL.jpg,https://dgobjects.blob.core.windows.net/thumbs/dg_1712600282_TN.jpg,,,,,
dg_1712600279,30,,Libby's additions,Letter to Patricia Swansey from President Leggett concerning the Black Library,,1972-04-19,"Leggett's response to the Black library proposal, addressed to CBS member Patricia Swansey",Black Library;Reactions to the Take Over;Concerned Black Students (CBS);Black Manifesto Demands,"Glenn Leggett, Grinnell President  1965-1975; Patricia Swansey '74",Burling Library,41.746718787662246,-92.72028416032282,,,text;scanned,application/pdf,eng,"Copyright to this work is held by the author(s), in accordance with United States copyright law (USC 17). Readers of this work have certain rights as defined by the law, including but not limited to fair use (17 USC 107 et seq.).",,,,,,https://dgobjects.blob.core.windows.net/objs/dg_1712600279.pdf,https://dgobjects.blob.core.windows.net/smalls/dg_1712600279_SMALL.jpg,https://dgobjects.blob.core.windows.net/thumbs/dg_1712600279_TN.jpg,,,,,
grinnell_5577,58,,,Math Homework in Burling,,1975,Photo of a student doing math homework in Burling Library.,Burling Library;Life at Grinnell for Black Students,,Burling Library,41.746718787662246,-92.72028416032282,Grinnell College,grinnell:5577,Image;StillImage,image/tiff,eng,"Copyright to this work is held by the author(s), in accordance with United States copyright law (USC 17). Readers of this work have certain rights as defined by the law, including but not limited to fair use (17 USC 107 et seq.).",,,,,,https://dgobjects.blob.core.windows.net/objs/grinnell-5577.tiff,https://dgobjects.blob.core.windows.net/smalls/grinnell-5577_SMALL.jpg,https://dgobjects.blob.core.windows.net/thumbs/grinnell-5577_TN.jpg,,,,,
dg_1712600284,9,,Libby's additions,Memo from the Joint Board of House Presidents,Joint Board of House of Presidents,1971-11-29,"This memo was sent by the Joint Board of the House of Presidents after the Burling Take Over. It references the tensions on campus between black and white members of Grinnell, and that all member of the Grinnell college community should respect the negotiations to alleviate the present tensions. The memo refers to the ""NBC Manifesto"", which was a racist satire of CBS’s Black Manifesto distributed soon after the take over.",Burling Library Take Over of '71 & '72;Reactions to the Take Over,,Grinnell College,41.74859288862407,-92.72189644676367,Grinnell College,,text;scanned,application/pdf,eng,"Copyright to this work is held by the author(s), in accordance with United States copyright law (USC 17). Readers of this work have certain rights as defined by the law, including but not limited to fair use (17 USC 107 et seq.).",,,,,,https://dgobjects.blob.core.windows.net/objs/dg_1712600284.pdf,https://dgobjects.blob.core.windows.net/smalls/dg_1712600284_SMALL.jpg,https://dgobjects.blob.core.windows.net/thumbs/dg_1712600284_TN.jpg,,,,,
grinnell_26760,59,,,"New Student Days, 1975",,1975,"New Student Days 1975: Auditorium. The Black Manifesto’s stated that “We demand that this administration establish a Black community with no less that 200 representatives taken from all walks of life of Black people, and that the responsibility of for the establishment of this community be co-shared by the present black community.”",Life at Grinnell for Black Students;Black Manifesto Demands,,Darby Gym,41.74929422,-92.71882604,Grinnell College,grinnell:26760,Image;StillImage,image/tiff,eng,"Copyright to this work is held by the author(s), in accordance with United States copyright law (USC 17). Readers of this work have certain rights as defined by the law, including but not limited to fair use (17 USC 107 et seq.).",,,,,,https://dgobjects.blob.core.windows.net/objs/grinnell-26760.tiff,https://dgobjects.blob.core.windows.net/smalls/grinnell-26760_SMALL.jpg,https://dgobjects.blob.core.windows.net/thumbs/grinnell-26760_TN.jpg,,,,,
grinnell_5775,52,,,New Student Moving In,"McMullin, Roger",1974,"A student moving in to dorms during New Student Days, 1974. The forth demand of the Black Manifesto state “that we, as Black students, have the final say on the residence of Black freshmen and sophomores;”",Life at Grinnell for Black Students;Black Manifesto Demands,,Younker Hall,41.75115638580055,-92.72141187646831,Grinnell College,grinnell:5775,Image;StillImage,image/tiff,eng,"Copyright to this work is held by the author(s), in accordance with United States copyright law (USC 17). Readers of this work have certain rights as defined by the law, including but not limited to fair use (17 USC 107 et seq.).",,,,,,https://dgobjects.blob.core.windows.net/objs/grinnell-5775.tiff,https://dgobjects.blob.core.windows.net/smalls/grinnell-5775_SMALL.jpg,https://dgobjects.blob.core.windows.net/thumbs/grinnell-5775_TN.jpg,,,,,
grinnell_3610,55,,,Outside of Burling Library and Forum,"Schultz, John",1974-05-03,Outside of Burling Library and Forum with Barbara L. Critton '75. Critton was a member of CBS and attended Grinnell College during the takeover.,Burling Library;Life at Grinnell for Black Students;Concerned Black Students (CBS),Barbara L. Critton '75,Burling Library,41.746718787662246,-92.72028416032282,Grinnell College,grinnell:5160,Image;StillImage,image/tiff,eng,"Copyright to this work is held by the author(s), in accordance with United States copyright law (USC 17). Readers of this work have certain rights as defined by the law, including but not limited to fair use (17 USC 107 et seq.).",,,,,,https://dgobjects.blob.core.windows.net/objs/grinnell-3610.tiff,https://dgobjects.blob.core.windows.net/smalls/grinnell-3610_SMALL.jpg,https://dgobjects.blob.core.windows.net/thumbs/grinnell-3610_TN.jpg,,,https://digital.grinnell.edu/islandora/object/grinnell:3610/datastream/OBJ,,https://digital.grinnell.edu/islandora/object/grinnell:3610/datastream/TN/view
dg_1712600272,66,,Libby's additions - Should this be a compound? ,"Poetry Reading, Black Martyrs Weekend Burling",Roger W McMullin,1978-04-21,Jon Williams '80 stands front of the Black Library for a Poetry reading during Black Martyrs weekend in 1978. Terri Tiddle '79 and Tony Whitaber '80 are in the background. The Black Library became a space for events that featured Black scholarship and excellence.,Black Library;Life at Grinnell for Black Students,,Burling Library,41.746718787662246,-92.72028416032282,Grinnell College,,Image;StillImage,image/jpeg,eng,"Copyright to this work is held by the author(s), in accordance with United States copyright law (USC 17). Readers of this work have certain rights as defined by the law, including but not limited to fair use (17 USC 107 et seq.).",,,,,,https://dgobjects.blob.core.windows.net/objs/dg_1712600272.jpg,https://dgobjects.blob.core.windows.net/smalls/dg_1712600272_SMALL.jpg,https://dgobjects.blob.core.windows.net/thumbs/dg_1712600272_TN.jpg,,,,,
dg_1712600273,67,,Libby's additions - Should this be a compound? ,"Poetry Reading, Black Martyrs Weekend Burling (2)",Roger W McMullin,1978-04-21,Jon Williams '80 and Julie Rogers '80 sit in front of the Black Library for a Poetry reading. The Black Library became a space for events that featured Black scholarship and excellence.,Black Library;Life at Grinnell for Black Students,,Burling Library,41.746718787662246,-92.72028416032282,Grinnell College,,Image;StillImage,image/jpeg,eng,"Copyright to this work is held by the author(s), in accordance with United States copyright law (USC 17). Readers of this work have certain rights as defined by the law, including but not limited to fair use (17 USC 107 et seq.).",,,,,,https://dgobjects.blob.core.windows.net/objs/dg_1712600273.jpg,https://dgobjects.blob.core.windows.net/smalls/dg_1712600273_SMALL.jpg,https://dgobjects.blob.core.windows.net/thumbs/dg_1712600273_TN.jpg,,,,,
